{
  "schema_version": "x-img.acquisition.v1",
  "catalogue_id": "fixture-catalogue",
  "revision": 1,
  "records": {
    "source_items": [
      {
        "source_item_id": "fixture-post-1",
        "source_kind": "x",
        "account_or_origin": "fixture-account",
        "source_item_kind": "post",
        "source_platform_id": "post-1",
        "source_url_aliases": [
          {
            "url": "https://x.example.invalid/post/1",
            "kind": "canonical_source",
            "first_seen_at": "2026-07-14T12:00:00Z",
            "last_seen_at": "2026-07-14T12:00:00Z"
          },
          {
            "url": "https://x.example.invalid/status/1",
            "kind": "observed_alias",
            "first_seen_at": "2026-07-14T12:01:00Z",
            "last_seen_at": "2026-07-14T12:01:00Z"
          }
        ],
        "discovered_at": "2026-07-14T12:00:00Z",
        "policy_result": "allowed",
        "provenance_ref": "audit-discovered"
      }
    ],
    "media_identities": [
      {
        "media_identity_id": "fixture-media-1",
        "source_item_id": "fixture-post-1",
        "media_kind": "image",
        "canonical_media_key": "x:fixture-account:post-1:media-1",
        "platform_media_id": "media-1",
        "platform_id_scope": "x:fixture-account",
        "content_sha256": "aaaaaaaaaaaaaaaaaaaaaaaaaaaaaaaaaaaaaaaaaaaaaaaaaaaaaaaaaaaaaaaa",
        "object_reference_id": "fixture-object-1",
        "state": "committed",
        "created_at": "2026-07-14T12:00:00Z",
        "updated_at": "2026-07-14T12:02:00Z"
      }
    ],
    "object_references": [
      {
        "object_reference_id": "fixture-object-1",
        "endpoint_id": "fixture-endpoint",
        "object_store_id": "fixture-store",
        "object_key": "x-img/fixture/media-1",
        "object_type": "original",
        "content_type": "image/jpeg",
        "byte_length": 12,
        "sha256": "aaaaaaaaaaaaaaaaaaaaaaaaaaaaaaaaaaaaaaaaaaaaaaaaaaaaaaaaaaaaaaaa",
        "etag": "fixture-etag-1",
        "verified_at": "2026-07-14T12:02:00Z",
        "committed_at": "2026-07-14T12:02:00Z",
        "provenance_ref": "audit-committed"
      }
    ],
    "download_attempts": [
      {
        "attempt_id": "fixture-attempt-1",
        "media_identity_id": "fixture-media-1",
        "job_id": "fixture-job-1",
        "attempt_number": 1,
        "state": "committed",
        "expected_length": 12,
        "received_length": 12,
        "received_sha256": "aaaaaaaaaaaaaaaaaaaaaaaaaaaaaaaaaaaaaaaaaaaaaaaaaaaaaaaaaaaaaaaa",
        "authority_upload_id": "fixture-upload-1",
        "started_at": "2026-07-14T12:01:00Z",
        "finished_at": "2026-07-14T12:02:00Z"
      }
    ],
    "job_leases": [
      {
        "lease_id": "fixture-lease-1",
        "job_id": "fixture-job-1",
        "scope_kind": "media",
        "scope_id": "fixture-media-1",
        "owner_id": "fixture-worker",
        "owner_nonce": "fixture-owner-nonce-1234",
        "issued_at": "2026-07-14T12:01:00Z",
        "expires_at": "2026-07-14T12:10:00Z",
        "heartbeat_at": "2026-07-14T12:01:30Z",
        "attempt": 1,
        "state": "released"
      }
    ],
    "account_cursors": [
      {
        "cursor_id": "fixture-cursor-1",
        "source_kind": "x",
        "account_id": "fixture-account",
        "connector_version": "0.1.0",
        "opaque_cursor": "fixture-cursor-value",
        "state": "valid",
        "observed_at": "2026-07-14T12:02:00Z"
      }
    ],
    "review_states": [
      {
        "review_state_id": "fixture-review-1",
        "media_identity_id": "fixture-media-1",
        "state": "new",
        "committed_object_reference_id": "fixture-object-1",
        "changed_at": "2026-07-14T12:02:00Z",
        "actor_ref": "fixture-worker"
      }
    ],
    "tombstones": [],
    "audit_events": [
      {
        "event_id": "audit-discovered",
        "event_kind": "discovered",
        "occurred_at": "2026-07-14T12:00:00Z",
        "actor_kind": "connector",
        "subject_kind": "source_item",
        "subject_id": "fixture-post-1"
      },
      {
        "event_id": "audit-committed",
        "event_kind": "catalogue_committed",
        "occurred_at": "2026-07-14T12:02:00Z",
        "actor_kind": "worker",
        "subject_kind": "media_identity",
        "subject_id": "fixture-media-1",
        "from_state": "verified",
        "to_state": "committed",
        "attempt_id": "fixture-attempt-1",
        "object_reference_id": "fixture-object-1",
        "checksum": "aaaaaaaaaaaaaaaaaaaaaaaaaaaaaaaaaaaaaaaaaaaaaaaaaaaaaaaaaaaaaaaa"
      }
    ]
  }
}
